Rank,Title,Year,Description,Director,Actor,IMDB Rating,Genre,Runtime,Metadata,Gross Earning,Vote
693,Awakenings,1990,"The victims of an encephalitis epidemic many years ago have been catatonic ever since, but now a new drug offers the prospect of reviving them.",Penny Marshall,"Penny Marshall,Robert De Niro,Robin Williams,Julie Kavner,Ruth Nelson",7.8,"Biography, Drama            ",121 ,74        ,52.10,141533
694,Majo no takkyûbin,1989,"A young witch, on her mandatory year of independent life, finds fitting into a new community difficult while she supports herself by running an air courier service.",Hayao Miyazaki,"Hayao Miyazaki,Kirsten Dunst,Minami Takayama,Rei Sakuma,Kappei Yamaguchi",7.8,"Animation, Adventure, Family            ",103 ,83        ,,144333
695,Glory,1989,"Robert Gould Shaw leads the U.S. Civil War's first all-black volunteer company, fighting prejudices from both his own Union Army, and the Confederates.",Edward Zwick,"Edward Zwick,Matthew Broderick,Denzel Washington,Cary Elwes,Morgan Freeman",7.8,"Biography, Drama, History            ",122 ,78        ,26.83,135275
696,Dip huet seung hung,1989,A disillusioned assassin accepts one last hit in hopes of using his earnings to restore vision to a singer he accidentally blinded.,John Woo,"John Woo,Chow Yun-Fat,Danny Lee,Sally Yeh,Kong Chu",7.8,"Action, Crime, Drama            ",111 ,82        ,,48664
697,Crimes and Misdemeanors,1989,An ophthalmologist's mistress threatens to reveal their affair to his wife while a married documentary filmmaker is infatuated with another woman.,Woody Allen,"Woody Allen,Martin Landau,Woody Allen,Bill Bernstein,Claire Bloom",7.8,"Comedy, Drama            ",104 ,77        ,18.25,58234
698,Back to the Future Part II,1989,"After visiting 2015, Marty McFly must repeat his visit to 1955 to prevent disastrous changes to 1985...without interfering with his first trip.",Robert Zemeckis,"Robert Zemeckis,Michael J. Fox,Christopher Lloyd,Lea Thompson,Tom Wilson",7.8,"Adventure, Comedy, Sci-Fi            ",108 ,57        ,118.50,529073
699,Mississippi Burning,1988,Two F.B.I. Agents with wildly different styles arrive in Mississippi to investigate the disappearance of some civil rights activists.,Alan Parker,"Alan Parker,Gene Hackman,Willem Dafoe,Frances McDormand,Brad Dourif",7.8,"Crime, Drama, History            ",128 ,65        ,34.60,101100
700,Predator,1987,A team of commandos on a mission in a Central American jungle find themselves hunted by an extraterrestrial warrior.,John McTiernan,"John McTiernan,Arnold Schwarzenegger,Carl Weathers,Kevin Peter Hall,Elpidia Carrillo",7.8,"Action, Adventure, Horror            ",107 ,47        ,59.74,421331
701,Ferris Bueller's Day Off,1986,"A high school wise guy is determined to have a day off from school, despite what the Principal thinks of that.",John Hughes,"John Hughes,Matthew Broderick,Alan Ruck,Mia Sara,Jeffrey Jones",7.8,Comedy            ,103 ,61        ,70.14,356860
702,The Breakfast Club,1985,Five high school students meet in Saturday detention and discover how they have a lot more in common than they thought.,John Hughes,"John Hughes,Emilio Estevez,Judd Nelson,Molly Ringwald,Ally Sheedy",7.8,"Comedy, Drama            ",97 ,66        ,45.88,396444
703,The Killing Fields,1984,"A journalist is trapped in Cambodia during tyrant Pol Pot's bloody 'Year Zero' cleansing campaign, which claimed the lives of two million 'undesirable' civilians.",Roland Joffé,"Roland Joffé,Sam Waterston,Haing S. Ngor,John Malkovich,Julian Sands",7.8,"Biography, Drama, History            ",141 ,76        ,34.70,55774
704,Ghostbusters,1984,"Three parapsychologists forced out of their university funding set up shop as a unique ghost removal service in New York City, attracting frightened yet skeptical customers.",Ivan Reitman,"Ivan Reitman,Bill Murray,Dan Aykroyd,Sigourney Weaver,Harold Ramis",7.8,"Action, Comedy, Fantasy            ",105 ,71        ,238.63,412507
705,The Right Stuff,1983,"The U.S. space program's development from the breaking of the sound barrier to selection of the Mercury 7 astronauts, from a group of test pilots with a more seat-of-the-pants approach than the program's more cautious engineers preferred.",Philip Kaufman,"Philip Kaufman,Sam Shepard,Scott Glenn,Ed Harris,Dennis Quaid",7.8,"Adventure, Biography, Drama            ",193 ,91        ,21.50,61761
706,The King of Comedy,1982,"Rupert Pupkin is a passionate yet unsuccessful comic who craves nothing more than to be in the spotlight and to achieve this, he stalks and kidnaps his idol to take the spotlight for himself.",Martin Scorsese,"Martin Scorsese,Robert De Niro,Jerry Lewis,Diahnne Abbott,Sandra Bernhard",7.8,"Comedy, Crime, Drama            ",109 ,73        ,2.50,103874
707,Kramer vs. Kramer,1979,"After his wife leaves him, a work-obsessed Manhattan advertising executive is forced to learn long-neglected parenting skills, but a heated custody battle over the couple's young son deepens the wounds left by the separation.",Robert Benton,"Robert Benton,Dustin Hoffman,Meryl Streep,Jane Alexander,Justin Henry",7.8,Drama            ,105 ,77        ,106.26,145454
708,All That Jazz,1979,"Director/choreographer Bob Fosse tells his own life story as he details the sordid career of Joe Gideon, a womanizing, drug-using dancer.",Bob Fosse,"Bob Fosse,Roy Scheider,Jessica Lange,Ann Reinking,Leland Palmer",7.8,"Drama, Music, Musical            ",123 ,72        ,37.82,32154
709,Days of Heaven,1978,A hot-tempered farm laborer convinces the woman he loves to marry their rich but dying boss so that they can have a claim to his fortune.,Terrence Malick,"Terrence Malick,Richard Gere,Brooke Adams,Sam Shepard,Linda Manz",7.8,"Drama, Romance            ",94 ,93        ,,58416
710,Dawn of the Dead,1978,"Following an ever-growing epidemic of zombies that have risen from the dead, two Philadelphia S.W.A.T. team members, a traffic reporter, and his television executive girlfriend seek refuge in a secluded shopping mall.",George A. Romero,"George A. Romero,David Emge,Ken Foree,Scott H. Reiniger,Gaylen Ross",7.8,"Horror, Thriller            ",127 ,71        ,5.10,120825
711,The Outlaw Josey Wales,1976,Missouri farmer Josey Wales joins a Confederate guerrilla unit and winds up on the run from the Union soldiers who murdered his family.,Clint Eastwood,"Clint Eastwood,Clint Eastwood,Sondra Locke,Chief Dan George,Bill McKinney",7.8,Western            ,135 ,69        ,31.80,74116
712,The Man Who Would Be King,1975,"Two former British soldiers in 1880s India decide to set themselves up as Kings in Kafiristan, a land where no white man has set foot since Alexander the Great.",John Huston,"John Huston,Sean Connery,Michael Caine,Christopher Plummer,Saeed Jaffrey",7.8,"Adventure, History, War            ",129 ,91        ,,49247
713,La montaña sagrada,1973,"In a corrupt, greed-fueled world, a powerful alchemist leads a messianic character and seven materialistic figures to the Holy Mountain, where they hope to achieve enlightenment.",Alejandro Jodorowsky,"Alejandro Jodorowsky,Alejandro Jodorowsky,Horacio Salinas,Zamira Saunders,Juan Ferrara",7.8,"Adventure, Drama, Fantasy            ",114 ,76        ,0.06,43345
714,The Conversation,1974,"A paranoid, secretive surveillance expert has a crisis of conscience when he suspects that the couple he is spying on will be murdered.",Francis Ford Coppola,"Francis Ford Coppola,Gene Hackman,John Cazale,Allen Garfield,Frederic Forrest",7.8,"Drama, Mystery, Thriller            ",113 ,87        ,4.42,112168
715,The Day of the Jackal,1973,"In the aftermath of France allowing Algeria's independence, a group of resentful military veterans hire a professional assassin codenamed ""Jackal"" to kill President Charles de Gaulle.",Fred Zinnemann,"Fred Zinnemann,Edward Fox,Terence Alexander,Michel Auclair,Alan Badel",7.8,"Crime, Drama, Thriller            ",143 ,80        ,16.06,41273
716,Le charme discret de la bourgeoisie,1972,"A surreal, virtually plotless series of dreams centered around six middle-class people and their consistently interrupted attempts to have a meal together.",Luis Buñuel,"Luis Buñuel,Fernando Rey,Delphine Seyrig,Paul Frankeur,Bulle Ogier",7.8,Comedy            ,102 ,93        ,0.20,43285
717,Cabaret,1972,A female girlie club entertainer in Weimar Republic era Berlin romances two men while the Nazi Party rises to power around them.,Bob Fosse,"Bob Fosse,Liza Minnelli,Michael York,Helmut Griem,Joel Grey",7.8,"Drama, Music, Musical            ",124 ,80        ,42.77,55343
718,"Aguirre, der Zorn Gottes",1972,"In the 16th century, the ruthless and insane Don Lope de Aguirre leads a Spanish expedition in search of El Dorado.",Werner Herzog,"Werner Herzog,Klaus Kinski,Ruy Guerra,Helena Rojo,Del Negro",7.8,"Action, Adventure, Biography            ",95 ,,,57444
719,Willy Wonka & the Chocolate Factory,1971,A poor but hopeful boy seeks one of the five coveted golden tickets that will send him on a tour of Willy Wonka's mysterious chocolate factory.,Mel Stuart,"Mel Stuart,Gene Wilder,Jack Albertson,Peter Ostrum,Roy Kinnear",7.8,"Family, Fantasy, Musical            ",100 ,67        ,4.00,201225
720,Midnight Cowboy,1969,"A naive hustler travels from Texas to New York City to seek personal fortune, finding a new friend in the process.",John Schlesinger,"John Schlesinger,Dustin Hoffman,Jon Voight,Sylvia Miles,John McGiver",7.8,Drama            ,113 ,79        ,44.79,111236
721,Night of the Living Dead,1968,A ragtag group of Pennsylvanians barricade themselves in an old farmhouse to remain safe from a horde of flesh-eating ghouls that are ravaging the East Coast of the United States.,George A. Romero,"George A. Romero,Duane Jones,Judith O'Dea,Karl Hardman,Marilyn Eastman",7.8,"Horror, Thriller            ",96 ,89        ,0.09,128619
722,Guess Who's Coming to Dinner,1967,A couple's attitudes are challenged when their daughter introduces them to her African-American fiancé.,Stanley Kramer,"Stanley Kramer,Spencer Tracy,Sidney Poitier,Katharine Hepburn,Katharine Houghton",7.8,"Comedy, Drama            ",108 ,63        ,56.70,45549
723,Les parapluies de Cherbourg,1964,A young woman separated from her lover by war faces a life-altering decision.,Jacques Demy,"Jacques Demy,Catherine Deneuve,Nino Castelnuovo,Anne Vernon,Marc Michel",7.8,"Drama, Musical, Romance            ",91 ,86        ,0.03,27844
724,My Fair Lady,1964,"In 1910s London, snobbish phonetics professor Henry Higgins agrees to a wager that he can make crude flower girl, Eliza Doolittle, presentable in high society.",George Cukor,"George Cukor,Audrey Hepburn,Rex Harrison,Stanley Holloway,Wilfrid Hyde-White",7.8,"Drama, Family, Musical            ",170 ,95        ,72.00,95747
725,Mary Poppins,1964,"In turn of the century London, a magical nanny employs music and adventure to help two neglected children become closer to their father.",Robert Stevenson,"Robert Stevenson,Julie Andrews,Dick Van Dyke,David Tomlinson,Glynis Johns",7.8,"Comedy, Family, Fantasy            ",139 ,88        ,102.27,172508
726,The Innocents,1961,A young governess for two children becomes convinced that the house and grounds are haunted.,Jack Clayton,"Jack Clayton,Deborah Kerr,Peter Wyngarde,Megs Jenkins,Michael Redgrave",7.8,Horror            ,100 ,88        ,2.62,30564
727,L'avventura,1960,"A woman disappears during a Mediterranean boating trip. During the search, her lover and her best friend become attracted to each other.",Michelangelo Antonioni,"Michelangelo Antonioni,Gabriele Ferzetti,Monica Vitti,Lea Massari,Dominique Blanchar",7.8,"Drama, Mystery, Romance            ",144 ,,,29991
728,East of Eden,1955,"Two brothers in 1910s California struggle to maintain their strict, Bible-toting father's favor as an old secret about their long-absent mother comes to light.",Elia Kazan,"Elia Kazan,James Dean,Raymond Massey,Julie Harris,Burl Ives",7.8,Drama            ,118 ,72        ,,45805
729,The Day the Earth Stood Still,1951,"An alien lands in Washington, D.C. and tells the people of Earth that they must live peacefully or be destroyed as a danger to other planets.",Robert Wise,"Robert Wise,Michael Rennie,Patricia Neal,Hugh Marlowe,Sam Jaffe",7.8,"Drama, Sci-Fi            ",92 ,,,82096
730,The Asphalt Jungle,1950,"A major heist goes off as planned, but then double crosses, bad luck and solid police work cause everything to unravel.",John Huston,"John Huston,Sterling Hayden,Louis Calhern,Jean Hagen,James Whitmore",7.8,"Crime, Drama, Film-Noir            ",112 ,85        ,,27514
731,Red River,1948,"Dunson leads a cattle drive, the culmination of over 14 years of work, to its destination in Missouri. But his tyrannical behavior along the way causes a mutiny, led by his adopted son.",Howard Hawks,"Howard Hawks,Arthur Rosson,John Wayne,Montgomery Clift,Joanne Dru,Walter Brennan",7.8,"Drama, Western            ",133 ,,,31492
732,To Have and Have Not,1944,"During World War II, American expatriate Harry Morgan helps transport a French Resistance leader and his beautiful wife to Martinique while romancing a sensuous lounge singer.",Howard Hawks,"Howard Hawks,Humphrey Bogart,Lauren Bacall,Walter Brennan,Dolores Moran",7.8,"Adventure, Comedy, Film-Noir            ",100 ,90        ,,34987
733,Gaslight,1944,"Ten years after her aunt was murdered in their London home, a woman returns from Italy in the 1880s to resume residence with her new husband. His obsessive interest in the home rises from a secret that may require driving his wife insane.",George Cukor,"George Cukor,Charles Boyer,Ingrid Bergman,Joseph Cotten,May Whitty",7.8,"Crime, Drama, Mystery            ",114 ,78        ,,29313
734,Shadow of a Doubt,1943,"A teenage girl, overjoyed when her favorite uncle comes to visit the family in their quiet California town, slowly begins to suspect that he is in fact the ""Merry Widow"" killer sought by the authorities.",Alfred Hitchcock,"Alfred Hitchcock,Teresa Wright,Joseph Cotten,Macdonald Carey,Henry Travers",7.8,"Film-Noir, Thriller            ",108 ,94        ,,65820
735,His Girl Friday,1940,A newspaper editor uses every trick in the book to keep his ace reporter ex-wife from remarrying.,Howard Hawks,"Howard Hawks,Cary Grant,Rosalind Russell,Ralph Bellamy,Gene Lockhart",7.8,"Comedy, Drama, Romance            ",92 ,,0.30,58954
736,Stagecoach,1939,A group of people traveling on a stagecoach find their journey complicated by the threat of Geronimo and learn something about each other in the process.,John Ford,"John Ford,John Wayne,Claire Trevor,Andy Devine,John Carradine",7.8,"Adventure, Drama, Western            ",96 ,93        ,,49282
737,You Can't Take It with You,1938,"The son of a snobbish Wall Street banker becomes engaged to a woman from a good-natured but decidedly eccentric family, not realizing that his father is trying to force her family from their home for a real estate development.",Frank Capra,"Frank Capra,Jean Arthur,James Stewart,Lionel Barrymore,Edward Arnold",7.8,"Comedy, Drama, Romance            ",126 ,,4.66,26023
738,The Lady Vanishes,1938,"While travelling in continental Europe, a rich young playgirl realizes that an elderly lady seems to have disappeared from the train.",Alfred Hitchcock,"Alfred Hitchcock,Margaret Lockwood,Michael Redgrave,Paul Lukas,May Whitty",7.8,"Mystery, Thriller            ",96 ,98        ,,52883
739,Bringing Up Baby,1938,"While trying to secure a $1 million donation for his museum, a befuddled paleontologist is pursued by a flighty and often irritating heiress and her pet leopard, Baby.",Howard Hawks,"Howard Hawks,Katharine Hepburn,Cary Grant,Charles Ruggles,Walter Catlett",7.8,Comedy            ,102 ,91        ,,61745
740,A Night at the Opera,1935,A sly business manager and the wacky friends of two opera singers in Italy help them achieve success in America while humiliating their stuffy and snobbish enemies.,Sam Wood,"Sam Wood,Edmund Goulding,Groucho Marx,Chico Marx,Harpo Marx,Kitty Carlisle",7.8,"Comedy, Music, Musical            ",96 ,,2.54,33036
741,Bride of Frankenstein,1935,"Mary Shelley reveals the main characters of her novel survived: Dr. Frankenstein, goaded by an even madder scientist, builds his monster a mate.",James Whale,"James Whale,Boris Karloff,Elsa Lanchester,Colin Clive,Valerie Hobson",7.8,"Drama, Horror, Sci-Fi            ",75 ,95        ,4.36,48449
742,Duck Soup,1933,"Rufus T. Firefly is named the dictator of bankrupt Freedonia and declares war on neighboring Sylvania over the love of his wealthy backer Mrs. Teasdale, contending with two inept spies who can't seem to keep straight which side they're on.",Leo McCarey,"Leo McCarey,Groucho Marx,Harpo Marx,Chico Marx,Zeppo Marx",7.8,"Comedy, Musical            ",69 ,93        ,,60256
743,Freaks,1932,"A circus' beautiful trapeze artist agrees to marry the leader of side-show performers, but his deformed friends discover she is only marrying him for his inheritance.",Tod Browning,"Tod Browning,Wallace Ford,Leila Hyams,Olga Baclanova,Roscoe Ates",7.8,"Drama, Horror            ",64 ,80        ,0.63,46688
744,Frankenstein,1931,Dr. Frankenstein dares to tamper with life and death by creating a human monster out of lifeless body parts.,James Whale,"James Whale,Colin Clive,Mae Clarke,Boris Karloff,John Boles",7.8,"Drama, Horror, Sci-Fi            ",70 ,91        ,,72708
745,Roma,2018,A year in the life of a middle-class family's maid in Mexico City in the early 1970s.,Alfonso Cuarón,"Alfonso Cuarón,Yalitza Aparicio,Marina de Tavira,Diego Cortina Autrey,Carlos Peralta",7.7,Drama            ,135 ,96        ,,157762
746,Deadpool 2,2018,"Foul-mouthed mutant mercenary Wade Wilson (a.k.a. Deadpool) assembles a team of fellow mutant rogues to protect a young boy with supernatural abilities from the brutal, time-traveling cyborg Cable.",David Leitch,"David Leitch,Ryan Reynolds,Josh Brolin,Morena Baccarin,Julian Dennison",7.7,"Action, Adventure, Comedy            ",119 ,66        ,324.59,574222
747,Sound of Metal,2019,A heavy-metal drummer's life is thrown into freefall when he begins to lose his hearing.,Darius Marder,"Darius Marder,Riz Ahmed,Olivia Cooke,Paul Raci,Lauren Ridloff",7.7,"Drama, Music            ",120 ,82        ,,125896
748,Wind River,2017,A veteran hunter helps an FBI agent investigate the murder of a young woman on a Wyoming Native American reservation.,Taylor Sheridan,"Taylor Sheridan,Elizabeth Olsen,Jeremy Renner,Graham Greene,Kelsey Asbille",7.7,"Crime, Drama, Mystery            ",107 ,73        ,33.80,250470
749,Forushande,2016,"While Ranaa and Emad, a married couple, are participating in a production of ""Death of a Salesman,"" she is assaulted in their new home, which leaves him determined to find the perpetrator over his wife's traumatized objections.",Asghar Farhadi,"Asghar Farhadi,Shahab Hosseini,Taraneh Alidoosti,Mina Sadati,Babak Karimi",7.7,Drama            ,124 ,85        ,2.40,60703
750,Get Out,2017,"A young African-American visits his white girlfriend's parents for the weekend, where his simmering uneasiness about their reception of him eventually reaches a boiling point.",Jordan Peele,"Jordan Peele,Daniel Kaluuya,Allison Williams,Bradley Whitford,Catherine Keener",7.7,"Horror, Mystery, Thriller            ",104 ,85        ,176.04,597513
751,Mission: Impossible - Fallout,2018,"Ethan Hunt and his IMF team, along with some familiar allies, race against time after a mission gone wrong.",Christopher McQuarrie,"Christopher McQuarrie,Tom Cruise,Henry Cavill,Ving Rhames,Simon Pegg",7.7,"Action, Adventure, Thriller            ",147 ,86        ,220.16,330992
752,Perfetti sconosciuti,2016,"Seven long-time friends meet for dinner. They decide to share their text messages, emails and phone calls. Secrets are unveiled. Harmony trembles.",Paolo Genovese,"Paolo Genovese,Giuseppe Battiston,Anna Foglietta,Marco Giallini,Edoardo Leo",7.7,"Comedy, Drama            ",96 ,,,65450
753,Udta Punjab,2016,A story that revolves around drug abuse in the affluent north Indian State of Punjab and how the youth there have succumbed to it en-masse resulting in a socio-economic decline.,Abhishek Chaubey,"Abhishek Chaubey,Shahid Kapoor,Alia Bhatt,Kareena Kapoor,Diljit Dosanjh",7.7,"Action, Crime, Drama            ",148 ,,,30733
754,Kubo and the Two Strings,2016,A young boy named Kubo must locate a magical suit of armour worn by his late father in order to defeat a vengeful spirit from the past.,Travis Knight,"Travis Knight,Charlize Theron,Art Parkinson,Matthew McConaughey,Ralph Fiennes",7.7,"Animation, Action, Adventure            ",101 ,84        ,48.02,129240
755,En man som heter Ove,2015,"Ove, an ill-tempered, isolated retiree who spends his days enforcing block association rules and visiting his wife's grave, has finally given up on life just as an unlikely friendship develops with his boisterous new neighbors.",Hannes Holm,"Hannes Holm,Rolf Lassgård,Bahar Pars,Filip Berg,Ida Engvoll",7.7,"Comedy, Drama, Romance            ",116 ,70        ,3.36,55403
756,The Breadwinner,2017,"In 2001, Afghanistan is under the control of the Taliban. When her father is captured, a determined young girl disguises herself as a boy in order to provide for her family.",Nora Twomey,"Nora Twomey,Saara Chaudry,Soma Chhaya,Noorin Gulamgaus,Laara Sadiq",7.7,"Animation, Drama, Family            ",94 ,78        ,0.31,25598
757,Omoide no Marnie,2014,"Due to 12 y.o. Anna's asthma, she's sent to stay with relatives of her guardian in the Japanese countryside. She likes to be alone, sketching. She befriends Marnie. Who is the mysterious, blonde Marnie.",Hiromasa Yonebayashi,"Hiromasa Yonebayashi,Sara Takatsuki,Kasumi Arimura,Nanako Matsushima,Susumu Terajima",7.7,"Animation, Drama, Family            ",103 ,72        ,0.77,40810
758,The Theory of Everything,2014,A look at the relationship between the famous physicist Stephen Hawking and his wife.,James Marsh,"James Marsh,Eddie Redmayne,Felicity Jones,Tom Prior,Sophie Perry",7.7,"Biography, Drama, Romance            ",123 ,71        ,35.89,448749
759,Kingsman: The Secret Service,2014,"A spy organisation recruits a promising street kid into the agency's training program, while a global threat emerges from a twisted tech genius.",Matthew Vaughn,"Matthew Vaughn,Colin Firth,Taron Egerton,Samuel L. Jackson,Michael Caine",7.7,"Action, Adventure, Comedy            ",129 ,60        ,128.26,663579
760,The Fault in Our Stars,2014,Two teenage cancer patients begin a life-affirming journey to visit a reclusive author in Amsterdam.,Josh Boone,"Josh Boone,Shailene Woodley,Ansel Elgort,Nat Wolff,Laura Dern",7.7,"Drama, Romance            ",126 ,69        ,124.87,375883
761,Me and Earl and the Dying Girl,2015,"High schooler Greg, who spends most of his time making parodies of classic movies with his co-worker Earl, finds his outlook forever altered after befriending a classmate who has just been diagnosed with cancer.",Alfonso Gomez-Rejon,"Alfonso Gomez-Rejon,Thomas Mann,RJ Cyler,Olivia Cooke,Nick Offerman",7.7,"Comedy, Drama, Romance            ",105 ,74        ,6.74,132028
762,Birdman or (The Unexpected Virtue of Ignorance),2014,"A washed-up superhero actor attempts to revive his fading career by writing, directing, and starring in a Broadway production.",Alejandro G. Iñárritu,"Alejandro G. Iñárritu,Michael Keaton,Zach Galifianakis,Edward Norton,Andrea Riseborough",7.7,"Comedy, Drama            ",119 ,87        ,42.34,626997
763,Le passé,2013,"An Iranian man deserts his French wife and her two children to return to his homeland. Meanwhile, his wife starts up a new relationship, a reality her husband confronts upon his wife's request for a divorce.",Asghar Farhadi,"Asghar Farhadi,Bérénice Bejo,Tahar Rahim,Ali Mosaffa,Pauline Burlet",7.7,"Drama, Mystery            ",130 ,85        ,1.33,49130
764,La grande bellezza,2013,"Jep Gambardella has seduced his way through the lavish nightlife of Rome for decades, but after his 65th birthday and a shock from the past, Jep looks past the nightclubs and parties to find a timeless landscape of absurd, exquisite beauty.",Paolo Sorrentino,"Paolo Sorrentino,Toni Servillo,Carlo Verdone,Sabrina Ferilli,Carlo Buccirosso",7.7,Drama            ,141 ,86        ,2.85,90972
765,Ma vie de Courgette,2016,"After losing his mother, a young boy is sent to an orphanage with other orphans his age where he begins to learn the meaning of trust and true love.",Claude Barras,"Claude Barras,Gaspard Schlatter,Sixtine Murat,Paulin Jaccoud,Michel Vuillermoz",7.7,"Animation, Comedy, Drama            ",66 ,85        ,0.29,25663
766,La vie d'Adèle,2013,"Adèle's life is changed when she meets Emma, a young woman with blue hair, who will allow her to discover desire and to assert herself as a woman and as an adult. In front of others, Adèle grows, seeks herself, loses herself, and ultimately finds herself through love and loss.",Abdellatif Kechiche,"Abdellatif Kechiche,Léa Seydoux,Adèle Exarchopoulos,Salim Kechiouche,Aurélien Recoing",7.7,"Drama, Romance            ",180 ,89        ,2.20,152455
767,The Broken Circle Breakdown,2012,"Elise and Didier fall in love at first sight, in spite of their differences. He talks, she listens. He's a romantic atheist, she's a religious realist. When their daughter becomes seriously ill, their love is put on trial.",Felix van Groeningen,"Felix van Groeningen,Veerle Baetens,Johan Heldenbergh,Nell Cattrysse,Geert Van Rampelberg",7.7,"Drama, Music, Romance            ",111 ,70        ,0.18,41321
768,Kaze tachinu,2013,"A look at the life of Jiro Horikoshi, the man who designed Japanese fighter planes during World War II.",Hayao Miyazaki,"Hayao Miyazaki,Hideaki Anno,Hidetoshi Nishijima,Miori Takimoto,Masahiko Nishimura",7.7,"Animation, Biography, Drama            ",126 ,83        ,5.21,85965
