Rank,Title,Year,Description,Director,Actor,IMDB Rating,Genre,Runtime,Metadata,Gross Earning,Vote
463,The Maltese Falcon,1941,"San Francisco private detective Sam Spade takes on a case that involves him with three eccentric criminals, a gorgeous liar, and their quest for a priceless statuette, with the stakes rising after his partner is murdered.",John Huston,"John Huston,Humphrey Bogart,Mary Astor,Gladys George,Peter Lorre",8.0,"Crime, Film-Noir, Mystery            ",100 ,97        ,2.11,158727
464,The Shop Around the Corner,1940,"Two employees at a gift shop can barely stand each other, without realizing that they are falling in love through the post as each other's anonymous pen pal.",Ernst Lubitsch,"Ernst Lubitsch,Margaret Sullavan,James Stewart,Frank Morgan,Joseph Schildkraut",8.0,"Comedy, Drama, Romance            ",99 ,96        ,0.20,33285
465,Bronenosets Potemkin,1925,"In the midst of the Russian Revolution of 1905, the crew of the battleship Potemkin mutiny against the brutal, tyrannical regime of the vessel's officers. The resulting street demonstration in Odessa brings on a police massacre.",Sergei Eisenstein,"Sergei Eisenstein,Aleksandr Antonov,Vladimir Barskiy,Grigoriy Aleksandrov,Ivan Bobrov",8.0,"Drama, History, Thriller            ",75 ,97        ,0.05,57937
466,Das Cabinet des Dr. Caligari,1920,"Hypnotist Dr. Caligari uses a somnambulist, Cesare, to commit murders.",Robert Wiene,"Robert Wiene,Werner Krauss,Conrad Veidt,Friedrich Feher,Lil Dagover",8.0,"Horror, Mystery, Thriller            ",76 ,,,63999
467,Knives Out,2019,"A detective investigates the death of the patriarch of an eccentric, combative family.",Rian Johnson,"Rian Johnson,Daniel Craig,Chris Evans,Ana de Armas,Jamie Lee Curtis",7.9,"Comedy, Crime, Drama            ",130 ,82        ,165.36,614595
468,Manbiki kazoku,2018,A family of small-time crooks take in a child they find outside in the cold.,Hirokazu Koreeda,"Hirokazu Koreeda,Lily Franky,Sakura Andô,Kirin Kiki,Mayu Matsuoka",7.9,"Crime, Drama, Thriller            ",121 ,93        ,3.31,76336
469,Badhaai ho,2018,A man is embarrassed when he finds out his mother is pregnant.,Amit Ravindernath Sharma,"Amit Ravindernath Sharma,Ayushmann Khurrana,Neena Gupta,Nayim Saifi,Gajraj Rao",7.9,"Comedy, Drama            ",124 ,,,34693
470,Marriage Story,2019,Noah Baumbach's incisive and compassionate look at a marriage breaking up and a family staying together.,Noah Baumbach,"Noah Baumbach,Adam Driver,Scarlett Johansson,Julia Greer,Azhy Robertson",7.9,"Drama, Romance            ",137 ,94        ,2.00,305129
471,Super 30,2019,Based on the life of Patna-based mathematician Anand Kumar who runs the famed Super 30 program for IIT aspirants in Patna.,Vikas Bahl,"Vikas Bahl,Hrithik Roshan,Mrunal Thakur,Nandish Singh Sandhu,Veerendra Saxena",7.9,"Biography, Drama            ",154 ,,2.27,32034
472,Padman,2018,"Upon realizing the extent to which women are affected by their menses, a man sets out to create a sanitary pad machine and to provide inexpensive sanitary pads to the women of rural India.",R. Balki,"R. Balki,Akshay Kumar,Radhika Apte,Sonam Kapoor,Jyoti Subhash",7.9,"Biography, Comedy, Drama            ",140 ,,1.66,26334
473,Togo,2019,"The story of Togo, the sled dog who led the 1925 serum run despite being considered too small and weak to lead such an intense race.",Ericson Core,"Ericson Core,Willem Dafoe,Julianne Nicholson,Christopher Heyerdahl,Richard Dormer",7.9,"Adventure, Biography, Drama            ",113 ,69        ,,48852
474,Airlift,2016,"When Iraq invades Kuwait in August 1990, a callous Indian businessman becomes the spokesperson for more than 170,000 stranded countrymen.",Raja Menon,"Raja Menon,Akshay Kumar,Nimrat Kaur,Kumud Mishra,Prakash Belawadi",7.9,"Action, Drama, History            ",130 ,,,57120
475,M.S. Dhoni: The Untold Story,2016,The untold story of Mahendra Singh Dhoni's journey from ticket collector to trophy collector - the world-cup-winning captain of the Indian Cricket Team.,Neeraj Pandey,"Neeraj Pandey,Sushant Singh Rajput,Kiara Advani,Anupam Kher,Disha Patani",7.9,"Biography, Drama, Sport            ",184 ,,1.78,58041
476,Baby,2015,"An elite counter-intelligence unit learns of a plot, masterminded by a maniacal madman. With the clock ticking, it's up to them to track the terrorists' international tentacles and prevent them from striking at the heart of India.",Neeraj Pandey,"Neeraj Pandey,Akshay Kumar,Danny Denzongpa,Rana Daggubati,Taapsee Pannu",7.9,"Action, Crime, Thriller            ",159 ,,,57893
477,Sing Street,2016,A boy growing up in Dublin during the 1980s escapes his strained family life by starting a band to impress the mysterious girl he likes.,John Carney,"John Carney,Ferdia Walsh-Peelo,Aidan Gillen,Maria Doyle Kennedy,Jack Reynor",7.9,"Comedy, Drama, Music            ",106 ,79        ,3.24,93820
478,Thor: Ragnarok,2017,"Imprisoned on the planet Sakaar, Thor must race against time to return to Asgard and stop Ragnarök, the destruction of his world, at the hands of the powerful and ruthless villain Hela.",Taika Waititi,"Taika Waititi,Chris Hemsworth,Tom Hiddleston,Cate Blanchett,Mark Ruffalo",7.9,"Action, Adventure, Comedy            ",130 ,74        ,315.06,741854
479,Jojo Rabbit,2019,A young German boy in the Hitler Youth whose hero and imaginary friend is the country's dictator is shocked to discover that his mother is hiding a Jewish girl in their home.,Taika Waititi,"Taika Waititi,Roman Griffin Davis,Thomasin McKenzie,Scarlett Johansson,Taika Waititi",7.9,"Comedy, Drama, War            ",108 ,58        ,0.35,383365
480,Wonder,2017,"Based on the New York Times bestseller, this movie tells the incredibly inspiring and heartwarming story of August Pullman, a boy with facial differences who enters the fifth grade, attending a mainstream elementary school for the first time.",Stephen Chbosky,"Stephen Chbosky,Jacob Tremblay,Owen Wilson,Izabela Vidovic,Julia Roberts",7.9,"Drama, Family            ",113 ,66        ,132.42,164044
481,Arrival,2016,A linguist works with the military to communicate with alien lifeforms after twelve mysterious spacecraft appear around the world.,Denis Villeneuve,"Denis Villeneuve,Amy Adams,Jeremy Renner,Forest Whitaker,Michael Stuhlbarg",7.9,"Drama, Mystery, Sci-Fi            ",116 ,81        ,100.55,686657
482,Gully Boy,2019,A coming-of-age story based on the lives of street rappers in Mumbai.,Zoya Akhtar,"Zoya Akhtar,Ranveer Singh,Alia Bhatt,Siddhant Chaturvedi,Vijay Raaz",7.9,"Drama, Music, Romance            ",154 ,65        ,5.57,39748
483,Short Term 12,2013,A 20-something supervising staff member of a residential treatment facility navigates the troubled waters of that world alongside her co-worker and longtime boyfriend.,Destin Daniel Cretton,"Destin Daniel Cretton,Brie Larson,Frantz Turner,John Gallagher Jr.,Kaitlyn Dever",7.9,Drama            ,96 ,82        ,1.01,88030
484,Serbuan maut 2: Berandal,2014,"Only a short time after the first raid, Rama goes undercover with the thugs of Jakarta and plans to bring down the syndicate and uncover the corruption within his police force.",Gareth Evans,"Gareth Evans,Iko Uwais,Yayan Ruhian,Arifin Putra,Oka Antara",7.9,"Action, Crime, Thriller            ",150 ,71        ,2.63,123561
485,Before Midnight,2013,We meet Jesse and Celine nine years on in Greece. Almost two decades have passed since their first meeting on that train bound for Vienna.,Richard Linklater,"Richard Linklater,Ethan Hawke,Julie Delpy,Seamus Davey-Fitzpatrick,Ariane Labed",7.9,"Drama, Romance            ",109 ,94        ,8.11,158089
486,X-Men: Days of Future Past,2014,The X-Men send Wolverine to the past in a desperate effort to change history and prevent an event that results in doom for both humans and mutants.,Bryan Singer,"Bryan Singer,Patrick Stewart,Ian McKellen,Hugh Jackman,James McAvoy",7.9,"Action, Adventure, Sci-Fi            ",132 ,75        ,233.92,709519
487,The Batman,2022,"When a sadistic serial killer begins murdering key political figures in Gotham, Batman is forced to investigate the city's hidden corruption and question his family's involvement.",Matt Reeves,"Matt Reeves,Robert Pattinson,Zoë Kravitz,Jeffrey Wright,Colin Farrell",7.9,"Action, Crime, Drama            ",176 ,72        ,,605758
488,Bohemian Rhapsody,2018,"The story of the legendary British rock band Queen and lead singer Freddie Mercury, leading up to their famous performance at Live Aid (1985).",Bryan Singer,"Bryan Singer,Rami Malek,Lucy Boynton,Gwilym Lee,Ben Hardy",7.9,"Biography, Drama, Music            ",134 ,49        ,216.43,533814
489,Hoje Eu Quero Voltar Sozinho,2014,"Leonardo is a blind teenager searching for independence. His everyday life, the relationship with his best friend, Giovana, and the way he sees the world change completely with the arrival of Gabriel.",Daniel Ribeiro,"Daniel Ribeiro,Ghilherme Lobo,Fabio Audi,Tess Amorim,Lúcia Romano",7.9,"Drama, Romance            ",96 ,71        ,0.10,25616
490,The Artist,2011,An egomaniacal film star develops a relationship with a young dancer against the backdrop of Hollywood's silent era.,Michel Hazanavicius,"Michel Hazanavicius,Jean Dujardin,Bérénice Bejo,John Goodman,James Cromwell",7.9,"Comedy, Drama, Romance            ",100 ,89        ,44.67,241461
491,Edge of Tomorrow,2014,"A soldier fighting aliens gets to relive the same day over and over again, the day restarting every time he dies.",Doug Liman,"Doug Liman,Tom Cruise,Emily Blunt,Bill Paxton,Brendan Gleeson",7.9,"Action, Adventure, Sci-Fi            ",113 ,71        ,100.21,672946
492,Amour,2012,"Georges and Anne are an octogenarian couple. They are cultivated, retired music teachers. Their daughter, also a musician, lives in Britain with her family. One day, Anne has a stroke, and the couple's bond of love is severely tested.",Michael Haneke,"Michael Haneke,Jean-Louis Trintignant,Emmanuelle Riva,Isabelle Huppert,Alexandre Tharaud",7.9,Drama            ,127 ,94        ,6.74,100604
493,Darbareye Elly,2009,The mysterious disappearance of a kindergarten teacher during a picnic in the north of Iran is followed by a series of misadventures for her fellow travelers.,Asghar Farhadi,"Asghar Farhadi,Golshifteh Farahani,Shahab Hosseini,Taraneh Alidoosti,Sajjad Dolati",7.9,"Drama, Mystery            ",119 ,87        ,0.11,53694
494,Dev.D,2009,"After breaking up with his childhood sweetheart, a young man finds solace in drugs. Meanwhile, a teenage girl is caught in the world of prostitution. Will they be destroyed, or will they find redemption?",Anurag Kashyap,"Anurag Kashyap,Abhay Deol,Mahie Gill,Kalki Koechlin,Dibyendu Bhattacharya",7.9,"Comedy, Drama, Romance            ",144 ,,0.01,30853
495,My Name Is Khan,2010,An Indian Muslim man with Asperger's syndrome takes a challenge to speak to the President of the United States seriously and embarks on a cross-country journey.,Karan Johar,"Karan Johar,Shah Rukh Khan,Kajol,Sheetal Menon,Katie Amanda Keane",7.9,"Adventure, Drama, Romance            ",165 ,50        ,4.02,107269
496,Låt den rätte komma in,2008,"Oskar, an overlooked and bullied boy, finds love and revenge through Eli, a beautiful but peculiar girl.",Tomas Alfredson,"Tomas Alfredson,Kåre Hedebrant,Lina Leandersson,Per Ragnar,Henrik Dahl",7.9,"Drama, Fantasy, Horror            ",114 ,82        ,2.12,216991
497,District 9,2009,Violence ensues after an extraterrestrial race forced to live in slum-like conditions on Earth finds a kindred spirit in a government agent exposed to their biotechnology.,Neill Blomkamp,"Neill Blomkamp,Sharlto Copley,David James,Jason Cope,Nathalie Boltt",7.9,"Action, Sci-Fi, Thriller            ",112 ,81        ,115.65,679308
498,The Wrestler,2008,"A faded professional wrestler must retire, but finds his quest for a new life outside the ring a dispiriting struggle.",Darren Aronofsky,"Darren Aronofsky,Mickey Rourke,Marisa Tomei,Evan Rachel Wood,Mark Margolis",7.9,"Drama, Sport            ",109 ,80        ,26.24,306087
499,Jab We Met,2007,A depressed wealthy businessman finds his life changing after he meets a spunky and care-free young woman.,Imtiaz Ali,"Imtiaz Ali,Shahid Kapoor,Kareena Kapoor,Tarun Arora,Dara Singh Randhawa",7.9,"Comedy, Drama, Romance            ",138 ,,0.41,53331
500,Boyhood,2014,"The life of Mason, from early childhood to his arrival at college.",Richard Linklater,"Richard Linklater,Ellar Coltrane,Patricia Arquette,Ethan Hawke,Elijah Smith",7.9,Drama            ,165 ,100        ,25.38,354145
501,"4 luni, 3 saptamâni si 2 zile",2007,A woman assists her friend in arranging an illegal abortion in 1980s Romania.,Cristian Mungiu,"Cristian Mungiu,Anamaria Marinca,Laura Vasiliu,Vlad Ivanov,Alexandru Potocean",7.9,Drama            ,113 ,97        ,1.19,60509
502,Star Trek,2009,The brash James T. Kirk tries to live up to his father's legacy with Mr. Spock keeping him in check as a vengeful Romulan from the future creates black holes to destroy the Federation one planet at a time.,J.J. Abrams,"J.J. Abrams,Chris Pine,Zachary Quinto,Simon Pegg,Leonard Nimoy",7.9,"Action, Adventure, Sci-Fi            ",127 ,82        ,257.73,602865
503,Dallas Buyers Club,2013,"In 1985 Dallas, electrician and hustler Ron Woodroof works around the system to help AIDS patients get the medication they need after he is diagnosed with the disease.",Jean-Marc Vallée,"Jean-Marc Vallée,Matthew McConaughey,Jennifer Garner,Jared Leto,Steve Zahn",7.9,"Biography, Drama            ",117 ,79        ,27.30,486260
504,In Bruges,2008,"Guilt-stricken after a job gone wrong, hitman Ray and his partner await orders from their ruthless boss in Bruges, Belgium, the last place in the world Ray wants to be.",Martin McDonagh,"Martin McDonagh,Colin Farrell,Brendan Gleeson,Ciarán Hinds,Elizabeth Berrington",7.9,"Comedy, Crime, Drama            ",107 ,67        ,7.76,422780
505,The Man from Earth,2007,An impromptu goodbye party for Professor John Oldman becomes a mysterious interrogation after the retiring scholar reveals to his colleagues he has a longer and stranger past than they can imagine.,Richard Schenkman,"Richard Schenkman,David Lee Smith,Tony Todd,John Billingsley,Ellen Crawford",7.9,"Drama, Fantasy, Mystery            ",87 ,,,187647
506,Letters from Iwo Jima,2006,"The story of the battle of Iwo Jima between the United States and Imperial Japan during World War II, as told from the perspective of the Japanese who fought it.",Clint Eastwood,"Clint Eastwood,Ken Watanabe,Kazunari Ninomiya,Tsuyoshi Ihara,Ryô Kase",7.9,"Action, Adventure, Drama            ",141 ,89        ,13.76,163006
507,Life of Pi,2012,"A young man who survives a disaster at sea is hurtled into an epic journey of adventure and discovery. While cast away, he forms an unexpected connection with another survivor: a fearsome Bengal tiger.",Ang Lee,"Ang Lee,Suraj Sharma,Irrfan Khan,Adil Hussain,Tabu",7.9,"Adventure, Drama, Fantasy            ",127 ,79        ,124.99,627185
508,Fantastic Mr. Fox,2009,An urbane fox cannot resist returning to his farm raiding ways and then must help his community survive the farmers' retaliation.,Wes Anderson,"Wes Anderson,George Clooney,Meryl Streep,Bill Murray,Jason Schwartzman",7.9,"Animation, Adventure, Comedy            ",87 ,83        ,21.00,230778
509,Bin-jip,2004,A transient young man breaks into empty homes to partake of the vacationing residents' lives for a few days.,Kim Ki-duk,"Kim Ki-duk,Seung-Yun Lee,Hee Jae,Hyuk-ho Kwon,Jin-mo Joo",7.9,"Crime, Drama, Romance            ",88 ,72        ,0.24,55384
510,C.R.A.Z.Y.,2005,"A young French Canadian, one of five boys in a conservative family in the 1960s and 1970s, struggles to reconcile his emerging identity with his father's values.",Jean-Marc Vallée,"Jean-Marc Vallée,Michel Côté,Marc-André Grondin,Danielle Proulx,Émile Vallée",7.9,"Comedy, Drama            ",129 ,81        ,,32992
511,Vozvrashchenie,2003,"In the Russian wilderness, two brothers face a range of new, conflicting emotions when their father - a man they know only through a single photograph - resurfaces.",Andrey Zvyagintsev,"Andrey Zvyagintsev,Vladimir Garin,Ivan Dobronravov,Konstantin Lavronenko,Nataliya Vdovina",7.9,Drama            ,110 ,82        ,0.50,45647
512,Iron Man,2008,"After being held captive in an Afghan cave, billionaire engineer Tony Stark creates a unique weaponized suit of armor to fight evil.",Jon Favreau,"Jon Favreau,Robert Downey Jr.,Gwyneth Paltrow,Terrence Howard,Jeff Bridges",7.9,"Action, Adventure, Sci-Fi            ",126 ,79        ,318.41,1049747
513,Shaun of the Dead,2004,"The uneventful, aimless lives of a London electronics salesman and his layabout roommate are disrupted by the zombie apocalypse.",Edgar Wright,"Edgar Wright,Simon Pegg,Nick Frost,Kate Ashfield,Lucy Davis",7.9,"Comedy, Horror            ",99 ,76        ,13.54,555814
514,Kal Ho Naa Ho,2003,"Naina, an introverted, perpetually depressed girl's life changes when she meets Aman. But Aman has a secret of his own which changes their lives forever. Embroiled in all this is Rohit, Naina's best friend who conceals his love for her.",Nikkhil Advani,"Nikkhil Advani,Preity Zinta,Shah Rukh Khan,Saif Ali Khan,Jaya Bachchan",7.9,"Comedy, Drama, Musical            ",186 ,54        ,1.79,69520
515,Gegen die Wand,2004,"With the intention to break free from the strict familial restrictions, a suicidal young woman sets up a marriage of convenience with a forty-year-old addict, an act that will lead to an outburst of envious love.",Fatih Akin,"Fatih Akin,Birol Ünel,Sibel Kekilli,Güven Kiraç,Zarah Jane McKenzie",7.9,"Drama, Romance            ",121 ,78        ,,54533
516,Mystic River,2003,The lives of three men who were childhood friends are shattered when one of them has a family tragedy.,Clint Eastwood,"Clint Eastwood,Sean Penn,Tim Robbins,Kevin Bacon,Emmy Rossum",7.9,"Crime, Drama, Mystery            ",138 ,84        ,90.14,455354
517,Harry Potter and the Prisoner of Azkaban,2004,"Harry Potter, Ron and Hermione return to Hogwarts School of Witchcraft and Wizardry for their third year of study, where they delve into the mystery surrounding an escaped prisoner who poses a dangerous threat to the young wizard.",Alfonso Cuarón,"Alfonso Cuarón,Daniel Radcliffe,Emma Watson,Rupert Grint,Richard Griffiths",7.9,"Adventure, Family, Fantasy            ",142 ,82        ,249.36,627932
518,Ying xiong,2002,"A defense officer, Nameless, was summoned by the King of Qin regarding his success of terminating three warriors.",Yimou Zhang,"Yimou Zhang,Jet Li,Tony Chiu-Wai Leung,Maggie Cheung,Ziyi Zhang",7.9,"Action, Adventure, Drama            ",120 ,85        ,53.71,181588
519,Hable con ella,2002,Two men share an odd friendship while they care for two women who are both in deep comas.,Pedro Almodóvar,"Pedro Almodóvar,Rosario Flores,Javier Cámara,Darío Grandinetti,Leonor Watling",7.9,"Drama, Mystery, Romance            ",112 ,86        ,9.28,112635
520,No Man's Land,2001,"Bosnia and Herzegovina during 1993 at the time of the heaviest fighting between the two warring sides. Two soldiers from opposing sides in the conflict, Nino and Ciki, become trapped in no man's land, whilst a third soldier becomes a living booby trap.",Danis Tanovic,"Danis Tanovic,Branko Djuric,Rene Bitorajac,Filip Sovagovic,Georges Siatidis",7.9,"Comedy, Drama, War            ",98 ,84        ,1.06,47265
521,The Bourne Identity,2002,"A man is picked up by a fishing boat, bullet-riddled and suffering from amnesia, before racing to elude assassins and attempting to regain his memory.",Doug Liman,"Doug Liman,Franka Potente,Matt Damon,Chris Cooper,Clive Owen",7.9,"Action, Mystery, Thriller            ",119 ,68        ,121.66,545559
522,Nueve reinas,2000,"Two con artists try to swindle a stamp collector by selling him a sheet of counterfeit rare stamps (the ""nine queens"").",Fabián Bielinsky,"Fabián Bielinsky,Ricardo Darín,Gastón Pauls,Graciela Tenenbaum,María Mercedes Villagra",7.9,"Crime, Drama, Thriller            ",114 ,80        ,1.22,53172
523,Children of Men,2006,"In 2027, in a chaotic world in which women have somehow become infertile, a former activist agrees to help transport a miraculously pregnant woman to a sanctuary at sea.",Alfonso Cuarón,"Alfonso Cuarón,Julianne Moore,Clive Owen,Chiwetel Ejiofor,Michael Caine",7.9,"Action, Drama, Sci-Fi            ",109 ,84        ,35.55,499051
524,Wo hu cang long,2000,A young Chinese warrior steals a sword from a famed swordsman and then escapes into a world of romantic adventure with a mysterious man in the frontier of the nation.,Ang Lee,"Ang Lee,Chow Yun-Fat,Michelle Yeoh,Ziyi Zhang,Chang Chen",7.9,"Action, Adventure, Drama            ",120 ,94        ,128.08,269257
525,Almost Famous,2000,A high-school boy in the early 1970s is given the chance to write a story for Rolling Stone magazine about an up-and-coming rock band as he accompanies them on their concert tour.,Cameron Crowe,"Cameron Crowe,Billy Crudup,Patrick Fugit,Kate Hudson,Frances McDormand",7.9,"Adventure, Comedy, Drama            ",122 ,90        ,32.53,275995
526,Dancer in the Dark,2000,An Eastern European US immigrant with a love for musicals has to cope with the gradual loss of her vision.,Lars von Trier,"Lars von Trier,Björk,Catherine Deneuve,David Morse,Peter Stormare",7.9,"Crime, Drama, Musical            ",140 ,61        ,4.18,110157
527,Mulholland Dr.,2001,"After a car wreck on the winding Mulholland Drive renders a woman amnesiac, she and a perky Hollywood-hopeful search for clues and answers across Los Angeles in a twisting venture beyond dreams and reality.",David Lynch,"David Lynch,Naomi Watts,Laura Harring,Justin Theroux,Jeanne Bates",7.9,"Drama, Mystery, Thriller            ",147 ,85        ,7.22,354059
528,Shrek,2001,"A mean lord exiles fairytale creatures to the swamp of a grumpy ogre, who must go on a quest and rescue a princess for the lord in order to get his land back.",Andrew Adamson,"Andrew Adamson,Vicky Jenson,Mike Myers,Eddie Murphy,Cameron Diaz,John Lithgow",7.9,"Animation, Adventure, Comedy            ",90 ,84        ,267.67,671954
529,Toy Story 2,1999,"When Woody is stolen by a toy collector, Buzz and his friends set out on a rescue mission to save Woody before he becomes a museum toy property with his roundup gang Jessie, Prospector, and Bullseye.",John Lasseter,"John Lasseter,Ash Brannon,Lee Unkrich,Tom Hanks,Tim Allen,Joan Cusack,Kelsey Grammer",7.9,"Animation, Adventure, Comedy            ",92 ,88        ,245.85,577833
530,Titanic,1997,"A seventeen-year-old aristocrat falls in love with a kind but poor artist aboard the luxurious, ill-fated R.M.S. Titanic.",James Cameron,"James Cameron,Leonardo DiCaprio,Kate Winslet,Billy Zane,Kathy Bates",7.9,"Drama, Romance            ",194 ,75        ,659.33,1161293
531,Knockin' on Heaven's Door,1997,"Two terminally ill patients escape from a hospital, steal a car and rush towards the sea.",Thomas Jahn,"Thomas Jahn,Til Schweiger,Jan Josef Liefers,Thierry van Werveke,Moritz Bleibtreu",7.9,"Action, Crime, Comedy            ",87 ,,0.00,30766
532,Boogie Nights,1997,"Back when sex was safe, pleasure was a business and business was booming, an idealistic porn producer aspires to elevate his craft to an art when he discovers a hot young talent.",Paul Thomas Anderson,"Paul Thomas Anderson,Mark Wahlberg,Julianne Moore,Burt Reynolds,Luis Guzmán",7.9,Drama            ,155 ,85        ,26.40,265342
533,Mimi wo sumaseba,1995,"A love story between a girl who loves reading books, and a boy who has previously checked out all of the library books she chooses.",Yoshifumi Kondô,"Yoshifumi Kondô,Yoko Honna,Issey Takahashi,Takashi Tachibana,Shigeru Muroi",7.9,"Animation, Drama, Family            ",111 ,75        ,,62746
534,Kôkaku Kidôtai,1995,A cyborg policewoman and her partner hunt a mysterious and powerful hacker called the Puppet Master.,Mamoru Oshii,"Mamoru Oshii,Atsuko Tanaka,Iemasa Kayumi,Akio Ôtsuka,Kôichi Yamadera",7.9,"Animation, Action, Crime            ",83 ,76        ,0.52,143052
535,Once Were Warriors,1994,A family descended from Maori warriors is bedeviled by a violent father and the societal problems of being treated as outcasts.,Lee Tamahori,"Lee Tamahori,Rena Owen,Temuera Morrison,Mamaengaroa Kerr-Bell,Julian Arahanga",7.9,"Crime, Drama            ",102 ,77        ,2.20,34501
536,True Romance,1993,"In Detroit, a lonely pop culture geek marries a call girl, steals cocaine from her pimp, and tries to sell it in Hollywood. Meanwhile, the owners of the cocaine, the Mob, track them down in an attempt to reclaim it.",Tony Scott,"Tony Scott,Christian Slater,Patricia Arquette,Dennis Hopper,Val Kilmer",7.9,"Crime, Drama, Romance            ",119 ,59        ,12.28,226797
537,Trois couleurs: Bleu,1993,A woman struggles to find a way to live her life after the death of her husband and child.,Krzysztof Kieslowski,"Krzysztof Kieslowski,Juliette Binoche,Zbigniew Zamachowski,Julie Delpy,Benoît Régent",7.9,"Drama, Music, Mystery            ",94 ,85        ,1.32,102185
538,The Nightmare Before Christmas,1993,"Jack Skellington, king of Halloween Town, discovers Christmas Town, but his attempts to bring Christmas to his home causes confusion.",Henry Selick,"Henry Selick,Danny Elfman,Chris Sarandon,Catherine O'Hara,William Hickey",7.9,"Animation, Family, Fantasy            ",76 ,82        ,75.08,333329
539,Carlito's Way,1993,"A Puerto Rican former convict, just released from prison, pledges to stay away from drugs and violence despite the pressure around him and lead on to a better life outside of N.Y.C.",Brian De Palma,"Brian De Palma,Al Pacino,Sean Penn,Penelope Ann Miller,John Leguizamo",7.9,"Crime, Drama, Thriller            ",144 ,65        ,36.95,218351
